commented;modifiers;parameterAmount;loc;comment;code
false;public;1;4;;@Override public boolean equals(Object o) {     return o == INSTANCE. }
false;public;0;4;;@Override public int hashCode() {     return System.identityHashCode(this). }
false;public,static;1;3;;public static boolean is(User user) {     return INSTANCE.equals(user). }
false;public,static;1;3;;public static boolean is(String principal) {     return NAME.equals(principal). }
false;public,static;1;3;;public static boolean isAuthorized(String action) {     return PREDICATE.test(action). }
