commented;modifiers;parameterAmount;loc;comment;code
true;public;0;3;/**  * Gets the size of the memory segment, in bytes.  *  * @return The size of the memory segment.  */ ;// ------------------------------------------------------------------------ // Memory Segment Operations // ------------------------------------------------------------------------ /**  * Gets the size of the memory segment, in bytes.  *  * @return The size of the memory segment.  */ public int size() {     return size. }
true;public;0;3;/**  * Checks whether the memory segment was freed.  *  * @return <tt>true</tt>, if the memory segment has been freed, <tt>false</tt> otherwise.  */ ;/**  * Checks whether the memory segment was freed.  *  * @return <tt>true</tt>, if the memory segment has been freed, <tt>false</tt> otherwise.  */ public boolean isFreed() {     return address > addressLimit. }
true;public;0;5;/**  * Frees this memory segment.  *  * <p>After this operation has been called, no further operations are possible on the memory  * segment and will fail. The actual memory (heap or off-heap) will only be released after this  * memory segment object has become garbage collected.  */ ;/**  * Frees this memory segment.  *  * <p>After this operation has been called, no further operations are possible on the memory  * segment and will fail. The actual memory (heap or off-heap) will only be released after this  * memory segment object has become garbage collected.  */ public void free() {     // this ensures we can place no more data and trigger     // the checks for the freed segment     address = addressLimit + 1. }
true;public;0;3;/**  * Checks whether this memory segment is backed by off-heap memory.  *  * @return <tt>true</tt>, if the memory segment is backed by off-heap memory, <tt>false</tt> if  * it is backed by heap memory.  */ ;/**  * Checks whether this memory segment is backed by off-heap memory.  *  * @return <tt>true</tt>, if the memory segment is backed by off-heap memory, <tt>false</tt> if  * it is backed by heap memory.  */ public boolean isOffHeap() {     return heapMemory == null. }
true;public;0;7;/**  * Returns the byte array of on-heap memory segments.  *  * @return underlying byte array  *  * @throws IllegalStateException  * 		if the memory segment does not represent on-heap memory  */ ;/**  * Returns the byte array of on-heap memory segments.  *  * @return underlying byte array  *  * @throws IllegalStateException  * 		if the memory segment does not represent on-heap memory  */ public byte[] getArray() {     if (heapMemory != null) {         return heapMemory.     } else {         throw new IllegalStateException("Memory segment does not represent heap memory").     } }
true;public;0;7;/**  * Returns the memory address of off-heap memory segments.  *  * @return absolute memory address outside the heap  *  * @throws IllegalStateException  * 		if the memory segment does not represent off-heap memory  */ ;/**  * Returns the memory address of off-heap memory segments.  *  * @return absolute memory address outside the heap  *  * @throws IllegalStateException  * 		if the memory segment does not represent off-heap memory  */ public long getAddress() {     if (heapMemory == null) {         return address.     } else {         throw new IllegalStateException("Memory segment does not represent off heap memory").     } }
true;public,abstract;2;1;/**  * Wraps the chunk of the underlying memory located between <tt>offset</tt> and  * <tt>length</tt> in a NIO ByteBuffer.  *  * @param offset The offset in the memory segment.  * @param length The number of bytes to be wrapped as a buffer.  *  * @return A <tt>ByteBuffer</tt> backed by the specified portion of the memory segment.  * @throws IndexOutOfBoundsException Thrown, if offset is negative or larger than the memory segment size,  *                                   or if the offset plus the length is larger than the segment size.  */ ;/**  * Wraps the chunk of the underlying memory located between <tt>offset</tt> and  * <tt>length</tt> in a NIO ByteBuffer.  *  * @param offset The offset in the memory segment.  * @param length The number of bytes to be wrapped as a buffer.  *  * @return A <tt>ByteBuffer</tt> backed by the specified portion of the memory segment.  * @throws IndexOutOfBoundsException Thrown, if offset is negative or larger than the memory segment size,  *                                   or if the offset plus the length is larger than the segment size.  */ public abstract ByteBuffer wrap(int offset, int length).
true;public;0;3;/**  * Gets the owner of this memory segment. Returns null, if the owner was not set.  *  * @return The owner of the memory segment, or null, if it does not have an owner.  */ ;/**  * Gets the owner of this memory segment. Returns null, if the owner was not set.  *  * @return The owner of the memory segment, or null, if it does not have an owner.  */ public Object getOwner() {     return owner. }
true;public,abstract;1;1;/**  * Reads the byte at the given position.  *  * @param index The position from which the byte will be read  * @return The byte at the given position.  *  * @throws IndexOutOfBoundsException Thrown, if the index is negative, or larger or equal to the size of  *                                   the memory segment.  */ ;// ------------------------------------------------------------------------ // Random Access get() and put() methods // ------------------------------------------------------------------------ // ------------------------------------------------------------------------ // Notes on the implementation: We try to collapse as many checks as // possible. We need to obey the following rules to make this safe // against segfaults: //  // - Grab mutable fields onto the stack before checking and using. This // guards us against concurrent modifications which invalidate the // pointers // - Use subtractions for range checks, as they are tolerant // ------------------------------------------------------------------------ /**  * Reads the byte at the given position.  *  * @param index The position from which the byte will be read  * @return The byte at the given position.  *  * @throws IndexOutOfBoundsException Thrown, if the index is negative, or larger or equal to the size of  *                                   the memory segment.  */ public abstract byte get(int index).
true;public,abstract;2;1;/**  * Writes the given byte into this buffer at the given position.  *  * @param index The index at which the byte will be written.  * @param b The byte value to be written.  *  * @throws IndexOutOfBoundsException Thrown, if the index is negative, or larger or equal to the size of  *                                   the memory segment.  */ ;/**  * Writes the given byte into this buffer at the given position.  *  * @param index The index at which the byte will be written.  * @param b The byte value to be written.  *  * @throws IndexOutOfBoundsException Thrown, if the index is negative, or larger or equal to the size of  *                                   the memory segment.  */ public abstract void put(int index, byte b).
true;public,abstract;2;1;/**  * Bulk get method. Copies dst.length memory from the specified position to  * the destination memory.  *  * @param index The position at which the first byte will be read.  * @param dst The memory into which the memory will be copied.  *  * @throws IndexOutOfBoundsException Thrown, if the index is negative, or too large that the data between the  *                                   index and the memory segment end is not enough to fill the destination array.  */ ;/**  * Bulk get method. Copies dst.length memory from the specified position to  * the destination memory.  *  * @param index The position at which the first byte will be read.  * @param dst The memory into which the memory will be copied.  *  * @throws IndexOutOfBoundsException Thrown, if the index is negative, or too large that the data between the  *                                   index and the memory segment end is not enough to fill the destination array.  */ public abstract void get(int index, byte[] dst).
true;public,abstract;2;1;/**  * Bulk put method. Copies src.length memory from the source memory into the  * memory segment beginning at the specified position.  *  * @param index The index in the memory segment array, where the data is put.  * @param src The source array to copy the data from.  *  * @throws IndexOutOfBoundsException Thrown, if the index is negative, or too large such that the array  *                                   size exceed the amount of memory between the index and the memory  *                                   segment's end.  */ ;/**  * Bulk put method. Copies src.length memory from the source memory into the  * memory segment beginning at the specified position.  *  * @param index The index in the memory segment array, where the data is put.  * @param src The source array to copy the data from.  *  * @throws IndexOutOfBoundsException Thrown, if the index is negative, or too large such that the array  *                                   size exceed the amount of memory between the index and the memory  *                                   segment's end.  */ public abstract void put(int index, byte[] src).
true;public,abstract;4;1;/**  * Bulk get method. Copies length memory from the specified position to the  * destination memory, beginning at the given offset.  *  * @param index The position at which the first byte will be read.  * @param dst The memory into which the memory will be copied.  * @param offset The copying offset in the destination memory.  * @param length The number of bytes to be copied.  *  * @throws IndexOutOfBoundsException Thrown, if the index is negative, or too large that the requested number of  *                                   bytes exceed the amount of memory between the index and the memory  *                                   segment's end.  */ ;/**  * Bulk get method. Copies length memory from the specified position to the  * destination memory, beginning at the given offset.  *  * @param index The position at which the first byte will be read.  * @param dst The memory into which the memory will be copied.  * @param offset The copying offset in the destination memory.  * @param length The number of bytes to be copied.  *  * @throws IndexOutOfBoundsException Thrown, if the index is negative, or too large that the requested number of  *                                   bytes exceed the amount of memory between the index and the memory  *                                   segment's end.  */ public abstract void get(int index, byte[] dst, int offset, int length).
true;public,abstract;4;1;/**  * Bulk put method. Copies length memory starting at position offset from  * the source memory into the memory segment starting at the specified  * index.  *  * @param index The position in the memory segment array, where the data is put.  * @param src The source array to copy the data from.  * @param offset The offset in the source array where the copying is started.  * @param length The number of bytes to copy.  *  * @throws IndexOutOfBoundsException Thrown, if the index is negative, or too large such that the array  *                                   portion to copy exceed the amount of memory between the index and the memory  *                                   segment's end.  */ ;/**  * Bulk put method. Copies length memory starting at position offset from  * the source memory into the memory segment starting at the specified  * index.  *  * @param index The position in the memory segment array, where the data is put.  * @param src The source array to copy the data from.  * @param offset The offset in the source array where the copying is started.  * @param length The number of bytes to copy.  *  * @throws IndexOutOfBoundsException Thrown, if the index is negative, or too large such that the array  *                                   portion to copy exceed the amount of memory between the index and the memory  *                                   segment's end.  */ public abstract void put(int index, byte[] src, int offset, int length).
true;public,abstract;1;1;/**  * Reads one byte at the given position and returns its boolean  * representation.  *  * @param index The position from which the memory will be read.  * @return The boolean value at the given position.  *  * @throws IndexOutOfBoundsException Thrown, if the index is negative, or larger than the segment  *                                   size minus 1.  */ ;/**  * Reads one byte at the given position and returns its boolean  * representation.  *  * @param index The position from which the memory will be read.  * @return The boolean value at the given position.  *  * @throws IndexOutOfBoundsException Thrown, if the index is negative, or larger than the segment  *                                   size minus 1.  */ public abstract boolean getBoolean(int index).
true;public,abstract;2;1;/**  * Writes one byte containing the byte value into this buffer at the given  * position.  *  * @param index The position at which the memory will be written.  * @param value The char value to be written.  *  * @throws IndexOutOfBoundsException Thrown, if the index is negative, or larger than the segment  *                                   size minus 1.  */ ;/**  * Writes one byte containing the byte value into this buffer at the given  * position.  *  * @param index The position at which the memory will be written.  * @param value The char value to be written.  *  * @throws IndexOutOfBoundsException Thrown, if the index is negative, or larger than the segment  *                                   size minus 1.  */ public abstract void putBoolean(int index, boolean value).
true;public,final;1;14;/**  * Reads a char value from the given position, in the system's native byte order.  *  * @param index The position from which the memory will be read.  * @return The char value at the given position.  *  * @throws IndexOutOfBoundsException Thrown, if the index is negative, or larger than the segment  *                                   size minus 2.  */ ;/**  * Reads a char value from the given position, in the system's native byte order.  *  * @param index The position from which the memory will be read.  * @return The char value at the given position.  *  * @throws IndexOutOfBoundsException Thrown, if the index is negative, or larger than the segment  *                                   size minus 2.  */ @SuppressWarnings("restriction") public final char getChar(int index) {     final long pos = address + index.     if (index >= 0 && pos <= addressLimit - 2) {         return UNSAFE.getChar(heapMemory, pos).     } else if (address > addressLimit) {         throw new IllegalStateException("This segment has been freed.").     } else {         // index is in fact invalid         throw new IndexOutOfBoundsException().     } }
true;public,final;1;7;/**  * Reads a character value (16 bit, 2 bytes) from the given position, in little-endian byte order.  * This method's speed depends on the system's native byte order, and it  * is possibly slower than {@link #getChar(int)}. For most cases (such as  * transient storage in memory or serialization for I/O and network),  * it suffices to know that the byte order in which the value is written is the same as the  * one in which it is read, and {@link #getChar(int)} is the preferable choice.  *  * @param index The position from which the value will be read.  * @return The character value at the given position.  *  * @throws IndexOutOfBoundsException Thrown, if the index is negative, or larger than the segment size minus 2.  */ ;/**  * Reads a character value (16 bit, 2 bytes) from the given position, in little-endian byte order.  * This method's speed depends on the system's native byte order, and it  * is possibly slower than {@link #getChar(int)}. For most cases (such as  * transient storage in memory or serialization for I/O and network),  * it suffices to know that the byte order in which the value is written is the same as the  * one in which it is read, and {@link #getChar(int)} is the preferable choice.  *  * @param index The position from which the value will be read.  * @return The character value at the given position.  *  * @throws IndexOutOfBoundsException Thrown, if the index is negative, or larger than the segment size minus 2.  */ public final char getCharLittleEndian(int index) {     if (LITTLE_ENDIAN) {         return getChar(index).     } else {         return Character.reverseBytes(getChar(index)).     } }
true;public,final;1;7;/**  * Reads a character value (16 bit, 2 bytes) from the given position, in big-endian byte order.  * This method's speed depends on the system's native byte order, and it  * is possibly slower than {@link #getChar(int)}. For most cases (such as  * transient storage in memory or serialization for I/O and network),  * it suffices to know that the byte order in which the value is written is the same as the  * one in which it is read, and {@link #getChar(int)} is the preferable choice.  *  * @param index The position from which the value will be read.  * @return The character value at the given position.  *  * @throws IndexOutOfBoundsException Thrown, if the index is negative, or larger than the segment size minus 2.  */ ;/**  * Reads a character value (16 bit, 2 bytes) from the given position, in big-endian byte order.  * This method's speed depends on the system's native byte order, and it  * is possibly slower than {@link #getChar(int)}. For most cases (such as  * transient storage in memory or serialization for I/O and network),  * it suffices to know that the byte order in which the value is written is the same as the  * one in which it is read, and {@link #getChar(int)} is the preferable choice.  *  * @param index The position from which the value will be read.  * @return The character value at the given position.  *  * @throws IndexOutOfBoundsException Thrown, if the index is negative, or larger than the segment size minus 2.  */ public final char getCharBigEndian(int index) {     if (LITTLE_ENDIAN) {         return Character.reverseBytes(getChar(index)).     } else {         return getChar(index).     } }
true;public,final;2;14;/**  * Writes a char value to the given position, in the system's native byte order.  *  * @param index The position at which the memory will be written.  * @param value The char value to be written.  *  * @throws IndexOutOfBoundsException Thrown, if the index is negative, or larger than the segment  *                                   size minus 2.  */ ;/**  * Writes a char value to the given position, in the system's native byte order.  *  * @param index The position at which the memory will be written.  * @param value The char value to be written.  *  * @throws IndexOutOfBoundsException Thrown, if the index is negative, or larger than the segment  *                                   size minus 2.  */ @SuppressWarnings("restriction") public final void putChar(int index, char value) {     final long pos = address + index.     if (index >= 0 && pos <= addressLimit - 2) {         UNSAFE.putChar(heapMemory, pos, value).     } else if (address > addressLimit) {         throw new IllegalStateException("segment has been freed").     } else {         // index is in fact invalid         throw new IndexOutOfBoundsException().     } }
true;public,final;2;7;/**  * Writes the given character (16 bit, 2 bytes) to the given position in little-endian  * byte order. This method's speed depends on the system's native byte order, and it  * is possibly slower than {@link #putChar(int, char)}. For most cases (such as  * transient storage in memory or serialization for I/O and network),  * it suffices to know that the byte order in which the value is written is the same as the  * one in which it is read, and {@link #putChar(int, char)} is the preferable choice.  *  * @param index The position at which the value will be written.  * @param value The char value to be written.  *  * @throws IndexOutOfBoundsException Thrown, if the index is negative, or larger than the segment size minus 2.  */ ;/**  * Writes the given character (16 bit, 2 bytes) to the given position in little-endian  * byte order. This method's speed depends on the system's native byte order, and it  * is possibly slower than {@link #putChar(int, char)}. For most cases (such as  * transient storage in memory or serialization for I/O and network),  * it suffices to know that the byte order in which the value is written is the same as the  * one in which it is read, and {@link #putChar(int, char)} is the preferable choice.  *  * @param index The position at which the value will be written.  * @param value The char value to be written.  *  * @throws IndexOutOfBoundsException Thrown, if the index is negative, or larger than the segment size minus 2.  */ public final void putCharLittleEndian(int index, char value) {     if (LITTLE_ENDIAN) {         putChar(index, value).     } else {         putChar(index, Character.reverseBytes(value)).     } }
true;public,final;2;7;/**  * Writes the given character (16 bit, 2 bytes) to the given position in big-endian  * byte order. This method's speed depends on the system's native byte order, and it  * is possibly slower than {@link #putChar(int, char)}. For most cases (such as  * transient storage in memory or serialization for I/O and network),  * it suffices to know that the byte order in which the value is written is the same as the  * one in which it is read, and {@link #putChar(int, char)} is the preferable choice.  *  * @param index The position at which the value will be written.  * @param value The char value to be written.  *  * @throws IndexOutOfBoundsException Thrown, if the index is negative, or larger than the segment size minus 2.  */ ;/**  * Writes the given character (16 bit, 2 bytes) to the given position in big-endian  * byte order. This method's speed depends on the system's native byte order, and it  * is possibly slower than {@link #putChar(int, char)}. For most cases (such as  * transient storage in memory or serialization for I/O and network),  * it suffices to know that the byte order in which the value is written is the same as the  * one in which it is read, and {@link #putChar(int, char)} is the preferable choice.  *  * @param index The position at which the value will be written.  * @param value The char value to be written.  *  * @throws IndexOutOfBoundsException Thrown, if the index is negative, or larger than the segment size minus 2.  */ public final void putCharBigEndian(int index, char value) {     if (LITTLE_ENDIAN) {         putChar(index, Character.reverseBytes(value)).     } else {         putChar(index, value).     } }
true;public,final;1;13;/**  * Reads a short integer value (16 bit, 2 bytes) from the given position, composing them into a short value  * according to the current byte order.  *  * @param index The position from which the memory will be read.  * @return The short value at the given position.  *  * @throws IndexOutOfBoundsException Thrown, if the index is negative, or larger than the segment  *                                   size minus 2.  */ ;/**  * Reads a short integer value (16 bit, 2 bytes) from the given position, composing them into a short value  * according to the current byte order.  *  * @param index The position from which the memory will be read.  * @return The short value at the given position.  *  * @throws IndexOutOfBoundsException Thrown, if the index is negative, or larger than the segment  *                                   size minus 2.  */ public final short getShort(int index) {     final long pos = address + index.     if (index >= 0 && pos <= addressLimit - 2) {         return UNSAFE.getShort(heapMemory, pos).     } else if (address > addressLimit) {         throw new IllegalStateException("segment has been freed").     } else {         // index is in fact invalid         throw new IndexOutOfBoundsException().     } }
true;public,final;1;7;/**  * Reads a short integer value (16 bit, 2 bytes) from the given position, in little-endian byte order.  * This method's speed depends on the system's native byte order, and it  * is possibly slower than {@link #getShort(int)}. For most cases (such as  * transient storage in memory or serialization for I/O and network),  * it suffices to know that the byte order in which the value is written is the same as the  * one in which it is read, and {@link #getShort(int)} is the preferable choice.  *  * @param index The position from which the value will be read.  * @return The short value at the given position.  *  * @throws IndexOutOfBoundsException Thrown, if the index is negative, or larger than the segment size minus 2.  */ ;/**  * Reads a short integer value (16 bit, 2 bytes) from the given position, in little-endian byte order.  * This method's speed depends on the system's native byte order, and it  * is possibly slower than {@link #getShort(int)}. For most cases (such as  * transient storage in memory or serialization for I/O and network),  * it suffices to know that the byte order in which the value is written is the same as the  * one in which it is read, and {@link #getShort(int)} is the preferable choice.  *  * @param index The position from which the value will be read.  * @return The short value at the given position.  *  * @throws IndexOutOfBoundsException Thrown, if the index is negative, or larger than the segment size minus 2.  */ public final short getShortLittleEndian(int index) {     if (LITTLE_ENDIAN) {         return getShort(index).     } else {         return Short.reverseBytes(getShort(index)).     } }
