commented;modifiers;parameterAmount;loc;comment;code
true;public,abstract;3;1;/**  * Bulk get method. Copies {@code numBytes} bytes from this memory segment, starting at position  * {@code offset} to the target {@code ByteBuffer}. The bytes will be put into the target buffer  * starting at the buffer's current position. If this method attempts to write more bytes than  * the target byte buffer has remaining (with respect to {@link ByteBuffer#remaining()}),  * this method will cause a {@link java.nio.BufferOverflowException}.  *  * @param offset The position where the bytes are started to be read from in this memory segment.  * @param target The ByteBuffer to copy the bytes to.  * @param numBytes The number of bytes to copy.  *  * @throws IndexOutOfBoundsException If the offset is invalid, or this segment does not  *           contain the given number of bytes (starting from offset), or the target byte buffer does  *           not have enough space for the bytes.  * @throws ReadOnlyBufferException If the target buffer is read-only.  */ ;/**  * Bulk get method. Copies {@code numBytes} bytes from this memory segment, starting at position  * {@code offset} to the target {@code ByteBuffer}. The bytes will be put into the target buffer  * starting at the buffer's current position. If this method attempts to write more bytes than  * the target byte buffer has remaining (with respect to {@link ByteBuffer#remaining()}),  * this method will cause a {@link java.nio.BufferOverflowException}.  *  * @param offset The position where the bytes are started to be read from in this memory segment.  * @param target The ByteBuffer to copy the bytes to.  * @param numBytes The number of bytes to copy.  *  * @throws IndexOutOfBoundsException If the offset is invalid, or this segment does not  *           contain the given number of bytes (starting from offset), or the target byte buffer does  *           not have enough space for the bytes.  * @throws ReadOnlyBufferException If the target buffer is read-only.  */ public abstract void get(int offset, ByteBuffer target, int numBytes).
true;public,abstract;3;1;/**  * Bulk put method. Copies {@code numBytes} bytes from the given {@code ByteBuffer}, into  * this memory segment. The bytes will be read from the target buffer  * starting at the buffer's current position, and will be written to this memory segment starting  * at {@code offset}.  * If this method attempts to read more bytes than  * the target byte buffer has remaining (with respect to {@link ByteBuffer#remaining()}),  * this method will cause a {@link java.nio.BufferUnderflowException}.  *  * @param offset The position where the bytes are started to be written to in this memory segment.  * @param source The ByteBuffer to copy the bytes from.  * @param numBytes The number of bytes to copy.  *  * @throws IndexOutOfBoundsException If the offset is invalid, or the source buffer does not  *           contain the given number of bytes, or this segment does  *           not have enough space for the bytes (counting from offset).  */ ;/**  * Bulk put method. Copies {@code numBytes} bytes from the given {@code ByteBuffer}, into  * this memory segment. The bytes will be read from the target buffer  * starting at the buffer's current position, and will be written to this memory segment starting  * at {@code offset}.  * If this method attempts to read more bytes than  * the target byte buffer has remaining (with respect to {@link ByteBuffer#remaining()}),  * this method will cause a {@link java.nio.BufferUnderflowException}.  *  * @param offset The position where the bytes are started to be written to in this memory segment.  * @param source The ByteBuffer to copy the bytes from.  * @param numBytes The number of bytes to copy.  *  * @throws IndexOutOfBoundsException If the offset is invalid, or the source buffer does not  *           contain the given number of bytes, or this segment does  *           not have enough space for the bytes (counting from offset).  */ public abstract void put(int offset, ByteBuffer source, int numBytes).
true;public,final;4;22;/**  * Bulk copy method. Copies {@code numBytes} bytes from this memory segment, starting at position  * {@code offset} to the target memory segment. The bytes will be put into the target segment  * starting at position {@code targetOffset}.  *  * @param offset The position where the bytes are started to be read from in this memory segment.  * @param target The memory segment to copy the bytes to.  * @param targetOffset The position in the target memory segment to copy the chunk to.  * @param numBytes The number of bytes to copy.  *  * @throws IndexOutOfBoundsException If either of the offsets is invalid, or the source segment does not  *           contain the given number of bytes (starting from offset), or the target segment does  *           not have enough space for the bytes (counting from targetOffset).  */ ;/**  * Bulk copy method. Copies {@code numBytes} bytes from this memory segment, starting at position  * {@code offset} to the target memory segment. The bytes will be put into the target segment  * starting at position {@code targetOffset}.  *  * @param offset The position where the bytes are started to be read from in this memory segment.  * @param target The memory segment to copy the bytes to.  * @param targetOffset The position in the target memory segment to copy the chunk to.  * @param numBytes The number of bytes to copy.  *  * @throws IndexOutOfBoundsException If either of the offsets is invalid, or the source segment does not  *           contain the given number of bytes (starting from offset), or the target segment does  *           not have enough space for the bytes (counting from targetOffset).  */ public final void copyTo(int offset, MemorySegment target, int targetOffset, int numBytes) {     final byte[] thisHeapRef = this.heapMemory.     final byte[] otherHeapRef = target.heapMemory.     final long thisPointer = this.address + offset.     final long otherPointer = target.address + targetOffset.     if ((numBytes | offset | targetOffset) >= 0 && thisPointer <= this.addressLimit - numBytes && otherPointer <= target.addressLimit - numBytes) {         UNSAFE.copyMemory(thisHeapRef, thisPointer, otherHeapRef, otherPointer, numBytes).     } else if (this.address > this.addressLimit) {         throw new IllegalStateException("this memory segment has been freed.").     } else if (target.address > target.addressLimit) {         throw new IllegalStateException("target memory segment has been freed.").     } else {         throw new IndexOutOfBoundsException(String.format("offset=%d, targetOffset=%d, numBytes=%d, address=%d, targetAddress=%d", offset, targetOffset, numBytes, this.address, target.address)).     } }
true;public,final;4;9;/**  * Bulk copy method. Copies {@code numBytes} bytes to target unsafe object and pointer.  * NOTE: This is a unsafe method, no check here, please be carefully.  *  * @param offset The position where the bytes are started to be read from in this memory segment.  * @param target The unsafe memory to copy the bytes to.  * @param targetPointer The position in the target unsafe memory to copy the chunk to.  * @param numBytes The number of bytes to copy.  *  * @throws IndexOutOfBoundsException If the source segment does not contain the given number  *           of bytes (starting from offset).  */ ;/**  * Bulk copy method. Copies {@code numBytes} bytes to target unsafe object and pointer.  * NOTE: This is a unsafe method, no check here, please be carefully.  *  * @param offset The position where the bytes are started to be read from in this memory segment.  * @param target The unsafe memory to copy the bytes to.  * @param targetPointer The position in the target unsafe memory to copy the chunk to.  * @param numBytes The number of bytes to copy.  *  * @throws IndexOutOfBoundsException If the source segment does not contain the given number  *           of bytes (starting from offset).  */ public final void copyToUnsafe(int offset, Object target, int targetPointer, int numBytes) {     final long thisPointer = this.address + offset.     if (thisPointer + numBytes > addressLimit) {         throw new IndexOutOfBoundsException(String.format("offset=%d, numBytes=%d, address=%d", offset, numBytes, this.address)).     }     UNSAFE.copyMemory(this.heapMemory, thisPointer, target, targetPointer, numBytes). }
true;public,final;4;9;/**  * Bulk copy method. Copies {@code numBytes} bytes from source unsafe object and pointer.  * NOTE: This is a unsafe method, no check here, please be carefully.  *  * @param offset The position where the bytes are started to be write in this memory segment.  * @param source The unsafe memory to copy the bytes from.  * @param sourcePointer The position in the source unsafe memory to copy the chunk from.  * @param numBytes The number of bytes to copy.  *  * @throws IndexOutOfBoundsException If this segment can not contain the given number  *           of bytes (starting from offset).  */ ;/**  * Bulk copy method. Copies {@code numBytes} bytes from source unsafe object and pointer.  * NOTE: This is a unsafe method, no check here, please be carefully.  *  * @param offset The position where the bytes are started to be write in this memory segment.  * @param source The unsafe memory to copy the bytes from.  * @param sourcePointer The position in the source unsafe memory to copy the chunk from.  * @param numBytes The number of bytes to copy.  *  * @throws IndexOutOfBoundsException If this segment can not contain the given number  *           of bytes (starting from offset).  */ public final void copyFromUnsafe(int offset, Object source, int sourcePointer, int numBytes) {     final long thisPointer = this.address + offset.     if (thisPointer + numBytes > addressLimit) {         throw new IndexOutOfBoundsException(String.format("offset=%d, numBytes=%d, address=%d", offset, numBytes, this.address)).     }     UNSAFE.copyMemory(source, sourcePointer, this.heapMemory, thisPointer, numBytes). }
true;public,final;4;26;/**  * Compares two memory segment regions.  *  * @param seg2 Segment to compare this segment with  * @param offset1 Offset of this segment to start comparing  * @param offset2 Offset of seg2 to start comparing  * @param len Length of the compared memory region  *  * @return 0 if equal, -1 if seg1 &lt. seg2, 1 otherwise  */ ;// ------------------------------------------------------------------------- // Comparisons & Swapping // ------------------------------------------------------------------------- /**  * Compares two memory segment regions.  *  * @param seg2 Segment to compare this segment with  * @param offset1 Offset of this segment to start comparing  * @param offset2 Offset of seg2 to start comparing  * @param len Length of the compared memory region  *  * @return 0 if equal, -1 if seg1 &lt. seg2, 1 otherwise  */ public final int compare(MemorySegment seg2, int offset1, int offset2, int len) {     while (len >= 8) {         long l1 = this.getLongBigEndian(offset1).         long l2 = seg2.getLongBigEndian(offset2).         if (l1 != l2) {             return (l1 < l2) ^ (l1 < 0) ^ (l2 < 0) ? -1 : 1.         }         offset1 += 8.         offset2 += 8.         len -= 8.     }     while (len > 0) {         int b1 = this.get(offset1) & 0xff.         int b2 = seg2.get(offset2) & 0xff.         int cmp = b1 - b2.         if (cmp != 0) {             return cmp.         }         offset1++.         offset2++.         len--.     }     return 0. }
true;public,final;5;29;/**  * Swaps bytes between two memory segments, using the given auxiliary buffer.  *  * @param tempBuffer The auxiliary buffer in which to put data during triangle swap.  * @param seg2 Segment to swap bytes with  * @param offset1 Offset of this segment to start swapping  * @param offset2 Offset of seg2 to start swapping  * @param len Length of the swapped memory region  */ ;/**  * Swaps bytes between two memory segments, using the given auxiliary buffer.  *  * @param tempBuffer The auxiliary buffer in which to put data during triangle swap.  * @param seg2 Segment to swap bytes with  * @param offset1 Offset of this segment to start swapping  * @param offset2 Offset of seg2 to start swapping  * @param len Length of the swapped memory region  */ public final void swapBytes(byte[] tempBuffer, MemorySegment seg2, int offset1, int offset2, int len) {     if ((offset1 | offset2 | len | (tempBuffer.length - len)) >= 0) {         final long thisPos = this.address + offset1.         final long otherPos = seg2.address + offset2.         if (thisPos <= this.addressLimit - len && otherPos <= seg2.addressLimit - len) {             // this -> temp buffer             UNSAFE.copyMemory(this.heapMemory, thisPos, tempBuffer, BYTE_ARRAY_BASE_OFFSET, len).             // other -> this             UNSAFE.copyMemory(seg2.heapMemory, otherPos, this.heapMemory, thisPos, len).             // temp buffer -> other             UNSAFE.copyMemory(tempBuffer, BYTE_ARRAY_BASE_OFFSET, seg2.heapMemory, otherPos, len).             return.         } else if (this.address > this.addressLimit) {             throw new IllegalStateException("this memory segment has been freed.").         } else if (seg2.address > seg2.addressLimit) {             throw new IllegalStateException("other memory segment has been freed.").         }     }     // index is in fact invalid     throw new IndexOutOfBoundsException(String.format("offset1=%d, offset2=%d, len=%d, bufferSize=%d, address1=%d, address2=%d", offset1, offset2, len, tempBuffer.length, this.address, seg2.address)). }
true;public,final;4;22;/**  * Equals two memory segment regions.  *  * @param seg2 Segment to equal this segment with  * @param offset1 Offset of this segment to start equaling  * @param offset2 Offset of seg2 to start equaling  * @param length Length of the equaled memory region  *  * @return true if equal, false otherwise  */ ;/**  * Equals two memory segment regions.  *  * @param seg2 Segment to equal this segment with  * @param offset1 Offset of this segment to start equaling  * @param offset2 Offset of seg2 to start equaling  * @param length Length of the equaled memory region  *  * @return true if equal, false otherwise  */ public final boolean equalTo(MemorySegment seg2, int offset1, int offset2, int length) {     int i = 0.     // Compare 8 bytes at a time.     while (i <= length - 8) {         if (getLong(offset1 + i) != seg2.getLong(offset2 + i)) {             return false.         }         i += 8.     }     // cover the last (length % 8) elements.     while (i < length) {         if (get(offset1 + i) != seg2.get(offset2 + i)) {             return false.         }         i += 1.     }     return true. }
